"What Are Your Moves Tomorrow, June 01, 2023"
Correction Incoming on 430 Spy line??
I’ll sleep easy with my House Money 1DTEs
"First big win, thank you $lulu"
VOTE in house for debt ceiling is 8:30 PM TONIGHT. likely today is flat / bearish and tomorrow will pop assuming it passes house
You just don’t short Apple 🤷‍♂️
Volume tickers in play
$TSLA YOLO - 6/1/23
Up $30k on $TSLA. I came to collect.
Summer of blockbusters and Cinemark (CNK) is ready to pop!
I swear to god they do this on purpose at this point
Uncle Mark is buying me a tesla
AI circus continues
TAP - MolsonCoors Calls
Turned $400-->$5000 went full degen
"$47,000 $TROW YOLO AND HALF MILLION $ in the stock 🚀"
"And now 3D Systems is trying to buy Stratasys, the drama of 3D Printing continues."
Book recommendations for starting with trading
"""This innovative A.I. company is has patent pending technology that could revolutionize the future"""
exciting journey as a bear in 2023
Nvidia joins exclusive club after hitting US$1 trillion market value
Yahoo News with their finger on the pulse again
How it feels to have a Trader Brother
I'm a victim of FOMO
WSB Rules - Please Read Before Posting
A year salary gone in degen gambling. Ready for the start again
"Earnings for the Week of June 5, 2023"
"Daily Discussion Thread for June 01, 2023"
Current state of the market
"Asian Stocks Surge On Debt Bill Progress, Fed Pause Hopes"
'2000 Deja Vu': Fred Hickey says AI rally is no different than Dot-com bubble By Investing.com
"Daily Discussion Thread for May 31, 2023"
"Q1 FDIC: Bank Profits Hit $79.8bn (+33.6% YoY), 2/3 of Banks Increase Net Income. A Banking Crisis or a Few Poor Risk Managers?"
"'Pharma Bros', Insider Trading and Wild Swings - Questions/Discussion"
CRWD Earnings Financials!
Started forex trading and finally made it to wall st
Nice
Is Epstein chatters causing the fall in $VSCO or it's just Victoria dumping her shares?
"To celebrate Nvidia's 1T valuation today, let me take this video out of context"
"$75 Million in Legal Marijuana Sold in Nevada in March, $634 Million During Current Fiscal Year"
TIME TO BUY $TGT
"Daily Discussion Thread for May 30, 2023"
Reg Reddit's IPO?
Watching everyone's AI gains and meanwhile im value investing like a pro
Crypto bill from Republicans lays out clear roles for SEC and CFTC
WHY jobs +339K yet unemployment increased to 3.7% + Fed + Market
$MDB call gains 10x 20x
"Senate passes debt ceiling bill, sending it to Biden to become law and avert disaster"
A tale of 3 headlines. What will the 4th bring?
Nvidia Stock (NVDA): What's Next After Blowout Quarter?
How low will AAP go?
Some Earnings Today After Market Close $DELL $AVGO $MDB $LULU
The 'Magnificent Seven' tech stocks drive markets higher as AI mania grips investors
MongoDB shares jump more than 20% after database company beats expectations and raises guidance
BABA buy before FOMO Sets in
Why Bears Never Get a Win
Bears self reflecting today 🐻
(Updated) *knock knock* C3.AI earnings call AH yesterday
NVIDIA Bears today
Senate approves compromise bill to raise debt limit : NPR
"With only a few days remaining, the Senate has granted its ultimate approval to a debt ceiling agreement, thereby sending it to Biden"
"Looking for an economically literate answer: why do commodities continue to fall in the markets, while goods continue to inflate at stores?"
Senate races to avert default but vote timing unclear for debt limit bill
"Hey banking sector, you ok?"
Highly regarded elon musk
$TROW YOLOOOO if that dude Inside_Stock_Trades is in then im fucking holding too 💎 💎 🦍 🙌
"With a VIX like this, what’s the market gonna do next?"
gonna need bigger AI
C3.A DIE
Hello permabears 👋 how's it going?
NVDA is sex on ice
Bears Are Fukt
Jerome Powell to everyone after turning printer on
Loaded up on SPY put spreads and ready to rollout
Title: Due Diligence Report - Siri Corp ($Siri)
🚀🌕✨ Palantards Assemble: Journey to the Moon is Finally Starting! ✨🚀🌕
"Daily Discussion Thread for June 02, 2023"
"Took a year off trading after a blow up. Started back up in May, glad with my decision so far."
"SPY Technical Analysis for Friday June 02, 2023"
Bears on actual life support rn
$TSLA Profit. Scared money don't make money. Sold ALL 13.20~13.30
"Welcome to June… 6-1-23 SPY/ES Futures, QQQ, VIX, 10YR Yield and DXY Daily Market Analysis"
$DELL will benefit immensely from the surge in AI adoption via their data center business
Nvidia hits $1 trillion market cap
NFLX pivot point here. Let’s see if it rallies or fails.
Fidelity cuts Reddit's valuation by 41%
The Fed Wants To Skip On A June Rate Increase And Then Hike Later - UNREAL
When you bet your life savings in AI
Satellite images to inform trades 🤔
Intel stock rebound
What is the fking chance I missed every fking trade
Put on lou lou lemon.
Nvidia's latest 2 hour keynote in 3 minutes
The single greatest lie in Real Estate. And the California exodus bubble.
Big Green Dildos Everywhere
What's going to happen with home improvement stores?
Debt ceiling bill faces a tough path in the House as GOP opposition grows
Market Recap - 5/31/23 - so many jobs
Will we see a Negative correlation or both stocks and bonds just rally? Second derivative matters!
"Debt ceiling deal won't have much impact on the US economy, analysts say"
Ultra Bears lose again as the latest rally crushes them
"Deja-VU Fed Speaker Addition… 5-31-23 SPY/ ES Futures, QQQ and VIX Daily Market Analysis"
"The odds of a 0.25% interest rate hike in June are now 67%, according to the CME's FedWatch Tool (It also shows that there is now a 30% chan"
Crypto Tax Avoided In Debt Ceiling
Soccer moms gotta have their Lulus.
"Earning plays for CRWD, CRM, AI, OKTA, and JWN"
It was good while it lasted thanks Cramer 🐻🐻🐻
🌈 🐻 fueling up for when the ratings agencies downgrade the US credit rating (like 2011)
Amazon talks to offer low-cost mobile services - Bloomberg News - To the moon!!!!!
*knock knock* C3.AI earnings call AH today
"Apple is over-bought. Last two times this happened, there was a cool-down."
"On September 19, 2022, Jim Cramer said to short Nvidia (NVDA), calling it a loser. Since then, NVDA is up 195%. 🤦‍♂️👎"
buy puts on every regional bank
Exercise AI Call or Sell short Call against it?
2k to 16k $Ai options play
"The VIX just had its lowest close since Pre-Covid … 6-2-23 SPY/ ES futures, QQQ and VIX Daily Market Analysis"
"Hackers use flaw in popular file transfer tool to steal data, researchers say $PRGS"
Unveiling the Debt Ceiling's Impact on the S&P 500 over the last 22 Debt Ceiling Events
Gotta spend money to lose money! LFG BABY 🚀🚀
Citi Strategist Says Tech Stock Rally Is Now at Risk of Fizzling Out. Barclays Disagrees.
"Robinhood Q1 Earnings: Found Stability, Could Become Interesting"
Anyone buying AAPL calls before WWDC
"Debt-Limit Deal Clears Congress, Ending Threat of US Default"
40k SPY 7/21 puts
Federal Reserve's Jefferson and Harker suggests central bank will pause in June
"Insider Trading Weekly Update #041: Buffett Cannot Get Enough $OXY, Royalty Pharma CEO Adds $4.8M | Insider Trading Recap"
Someone bought half a billion dollars worth of pypl after hours. Also 65 calls are being purchased. Huge 5% day tomorrow incoming??
Is technical analysis real or just a bunch of mumbo jumbo Nostradamus-crystal ball type of thing?
WOOOOOO
"Fed’s Balance Sheet Plunged by $348 Billion in the 10 Weeks since Peak Bank Crisis, and by $580 billion since QT Started"
"Weekend Discussion Thread for the Weekend of June 03, 2023"
Dollar General stock plunges as “challenging economic backdrop” drives dismal earnings report
"Fed's Loretta Mester on rate hikes: ""I don't really see a compelling reason to pause."""
Let’s go Ccl to 35$ help me afford an SF tent
The Giant Behind AI Technology: ASML Holdings N.V.
CNBC hire me
"C3.AI (AI) is down 7.53% today before earnings, after going up 50.04% over the past 5 days. Seems like a pretty good entry point!"
Three large cap stocks currently in value territory
"C3.ai earnings, why does it matter?"
Market Recap - 6/1/23 - Stonks only go up?
"When will tech join the sell off? 5-30-23 SPY/ ES Futures, QQQ, VIX, 10YR Yield/ DXY Daily Market Analysis"
Veradigm $MDRX A new player in healthcare software explosion
"Crude Oil Spotlight May 31, 2023. OPEC+ meeting just got much more interesting."
"Money stored in payment apps like Venmo may be more vulnerable than bank deposits, CFPB says"
"Palantir Announces Live Stream of its First AIPCon, with AI Demos & Announcements from 25+ Customers"
"If I'm long on a stock, why not buy a leveraged product?"
Short Sellers Lose 92% of Every Dollar Bet Against Chip Stocks
Bonds
Why LULU's earnings today will completely obliterate everyone
US debt ceiling: Republican hard-right vows to sink deal hours before vote expected
God bless A.I.
MDB stands for mongo dollarz biatch!
"What Are Your Moves Tomorrow, May 31, 2023"
$BUD PUTs +$35k (+127%) - Pour One Out for the “Real Men of Genius”
"NVDA opened at 405 on Tuesday, it's time to deliver"
I just can't win lately.
$AI 2K -> 11K in 3 Trading Days
SoftBank might be the next play with its Nvidia partnership
FHA bailing out delinquent mortgages
Question about my AI 41$ 6/9 call
Waiting for another VIX spike
I came to collect. Up $70k + on $TSLA
Tesla CEO Elon Musk praises Shanghai employees for meeting him near midnight after blasting the U.S. ‘laptop class’ on working from home
jepi vs svol
Ccl calls keep holding waiting for the moon pop.
Palantir(PLTR) Time for another look before 🚀🌕 - DD
"$AVGO may go to $1020 on June 2nd, 2023"
"If you’re tempted to ape into C3.now we’re called AI earnings, this might be one of those times shares are better than options"
Insider trading on ETRN
NVDA - time for puts!
"My $TSLA shares are worth $40,220 with an average cost of $169"
Missed the AI boat; can I drive there instead?
Felt like buying calls yesterday. Sold and switching to puts tomorrow
Time to go long value stocks
"What Are Your Moves Tomorrow, June 02, 2023"
How to profit off Applechia?
What the f@!# is going on with 3D printing? (Desktop Metal/Stratasys/Nano Dimension - The Next Industrial Revolution [Continued… May '23])
How do you all generally consume news and events through the market hours?
Euro zone inflation falls greater than expected as core pressures ease
Quantum Computing Emerges as Key to Solving Complex Business Problems
JPOW's wet dream confronts reality
US oil prices sink below $70 on debt ceiling jitters and Russia-Saudi tensions
Remember to stay POSITIVE
+6.3k from AI calls today. Back from the dead ☠️
S&P 500 is little changed to start June trading after debt bill passes House
"Ray Dalio says the US debt-ceiling agreement ""won't make much difference,"" and doesn't solve the main problem"
Forecasts for china's bad economy
Lots of activity right after close with $AAPL and wtf is a Lululemon and why didn't I get some calls on it
"Amazon Ring doorbell was used to spy on customers, FTC says"
40k PLTR Gain - let the bet ride rolling up & out. Palantir is the most important company in the world right now.
Any hope for $TDOC ?
I was told there would be more tendies.
Ho! Ho! Look at that..!!!
Me and the PLTR regards when the weight of heavy bags are finally lifted.
"22% of S&P 500 companies mentioned AI on their earnings calls, up from 10% in 2022:"
What is going on here at the Non-Farm payrolls report ?
"As the lobbying powerhouse fights for its survival, the president of the CBI makes an early departure"
Yes - The Fed Will Continue Raising Interest Rates
Someone being sneaky with their 1.3million $ bet pypl would go up 16%+ in 2 months... 😳 I should buy back my calls I'm selling lol
